{
    "api": "paddlenlp.metrics.squad.squad_evaluate",
    "type": "function",
    "version": "stable",
    "args_list": {
        "examples": null,
        "preds": null,
        "na_probs": "None",
        "na_prob_thresh": "1.0",
        "is_whitespace_splited": "True"
    },
    "description": "Computes and prints the f1 score and em score of input prediction.:param examples: List of raw squad-style data (see `run_squad.py<PaddlePaddle/PaddleNLPmachine_reading_comprehension/SQuAD/run_squad.py>`__ for moreinformation).preds (dict) – Dictionary of final predictions. Usually generated bycompute_prediction.na_probs (dict, optional) – Dictionary of score_diffs of each example.Used to decide if answer exits and compute best score_diffthreshold of null. Defaults to None.na_prob_thresh (float, optional) – The threshold used to select thenull answer. Defaults to 1.0.is_whitespace_splited (bool, optional) – Whether the predictions and referencescan be tokenized by whitespace. Usually set True for English andFalse for Chinese. Defaults to True.",
    "params": [
        {
            "name": "preds",
            "type": "dict",
            "description": "Dictionary of final predictions. Usually generated bycompute_prediction.",
            "default": "",
            "optional": false
        },
        {
            "name": "na_probs",
            "type": "dict",
            "description": "Dictionary of score_diffs of each example.Used to decide if answer exits and compute best score_diffthreshold of null. Defaults to None.",
            "default": "None",
            "optional": true
        },
        {
            "name": "na_prob_thresh",
            "type": "float",
            "description": "The threshold used to select thenull answer. Defaults to 1.0.",
            "default": "1.0",
            "optional": true
        },
        {
            "name": "is_whitespace_splited",
            "type": "bool",
            "description": "Whether the predictions and referencescan be tokenized by whitespace. Usually set True for English andFalse for Chinese. Defaults to True.",
            "default": "True",
            "optional": true
        }
    ],
    "return": {
        "description": "",
        "type": ""
    }
}